{
  "error": [],
  "success": "/accessories-spare-parts/steering-cover-2787891",
  "ad_listing_id": 2787891,
  "ad_id": 2787891,
  "ad_listing": {
    "ad_id": 2787891,
    "city_name": "Lahore",
    "city_area": "Gulberg",
    "seller_comments": "This is a Test Ad",
    "price": "1500",
    "url_slug": "/accessories-spare-parts/steering-cover-2787891",
    "pictures_count": 1,
    "pictures": [
      {
        "picture_id": 20165699,
        "picture_thumbnail": "https://core.static1.pakkey.com/ad_pictures/2016/tn_steering-cover-20165699.webp",
        "picture_medium": "https://core.static1.pakkey.com/ad_pictures/2016/Slide_steering-cover-20165699.webp",
        "picture_original": "https://core.static2.pakkey.com/ad_pictures/2016/steering-cover-20165699.webp",
        "picture_title": "Steering Cover",
        "picture_alt": "Steering Cover"
      }
    ],
    "klass": "AdListing",
    "status": 2,
    "ad_listing_id": 2787891,
    "user": {
      "id": 1710789,
      "display_name": "Test",
      "mobile_verified": false
    },
    "condition": 1,
    "allow_whatsapp": true,
    "phone": "03601234567",
    "category": "Car Interior",
    "subcategory": "Steering Covers"
  },
  "custom_dimensions": {
    "user_type": "Individual"
  }
}
