{
  "error": [],
  "success": "/used-bikes/honda-cg-125-deluxe-2022-for-sale-in-lahore-208822",
  "ad_listing_id": 2787872,
  "ad_id": 208822,
  "ad_listing": {
    "ad_id": 208822,
    "city_name": "Lahore",
    "city_area": "DHA Defence",
    "seller_comments": "This is a test ad",
    "rich_description": null,
    "price": "199997",
    "monthly_installment": null,
    "remaining_months": null,
    "discount": null,
    "original_price": null,
    "promotion_end_time": null,
    "number_of_orders": null,
    "title": "Honda CG 125 Deluxe",
    "page_title": "Honda CG 125 Deluxe 2022",
    "url_slug": "/used-bikes/honda-cg-125-deluxe-2022-for-sale-in-lahore-208822",
    "pictures_count": 1,
    "pictures": [
      {
        "picture_id": 20165260,
        "picture_thumbnail": "https://core.static2.pakkey.com/ad_pictures/2016/tn_honda-cg-125-2-2022-20165260.webp",
        "picture_medium": "https://core.static1.pakkey.com/ad_pictures/2016/Slide_honda-cg-125-2-2022-20165260.webp",
        "picture_original": "https://core.static2.pakkey.com/ad_pictures/2016/honda-cg-125-2-2022-20165260.webp",
        "picture_title": "Honda CG 125 Deluxe 2022 for Sale",
        "picture_alt": "Honda CG 125 Deluxe 2022 for Sale"
      }
    ],
    "klass": "UsedBike",
    "video_link": null,
    "video_id": null,
    "chat_suspended": false,
    "status": 2,
    "bumped_count": 1,
    "available_boost_credits": 100,
    "required_boost_credits": 1,
    "is_featured": false,
    "ad_listing_id": 2787872,
    "last_updated": "14 Nov 2025",
    "user": {
      "id": 1710789,
      "cnic_verified": false,
      "username": "iostest7",
      "display_name": "Test",
      "member_since": "Feb 13, 2025",
      "city": "Lahore",
      "country": "Pakistan",
      "facebook_verified": false,
      "facebook_uid": null,
      "email_verified": true,
      "mobile_verified": false,
      "mobile_uuid": "96dbe58bb363ea0769b5fd6d72859702",
      "user_type": 1,
      "dealer_email": "N/A",
      "average_seller_rating": null,
      "dealer_address": "N/A",
      "dealer_timings": "N/A",
      "dealer_name": null,
      "dealer_logo": null,
      "dealer_slug": null
    },
    "phone_count": 0,
    "featured_request": false,
    "created_at": "14 Nov 2025",
    "condition": 0,
    "is_certified": false,
    "is_certified_requested": false,
    "dealership_id": null,
    "dealership_verified": null,
    "exceeded_limit": false,
    "disclaimer": null,
    "warranty_text": null,
    "browse_more": "https://core.pakkey.com/used-bikes/search/-/mk_honda/md_cg-125-deluxe/",
    "next_boost": 7,
    "featured_till": null,
    "paid_bump": true,
    "recommended_oil": "Shell ADVANCE",
    "oil_logo": "https://core.wsa1.pakkey.com/assets/recommended_oils/used_bike_oil-c9c6c759d0b1b020d9a165723ed9dc88333b52cc8917c131f0da9589b4cdba72.png",
    "oil_widget_name": "Honda Cg 125 Deluxe 2022",
    "oil_widget_target_url": "https://shell.pakwheels.com/shell-advance/",
    "allow_whatsapp": true,
    "phone": "03601234567",
    "phone_1": null,
    "activation_type": 1,
    "can_be_re_activated": true,
    "search_view_count": 0,
    "view_count": 0,
    "make": "Honda",
    "model": "CG 125 Deluxe",
    "model_year": 2022,
    "engine_type": "2-stroke",
    "registration_province": "Punjab",
    "features": "{:feature=>\"Anti Theft Lock\", :class=>\"anti_theft_lock\"}, {:feature=>\"Led Light\", :class=>\"led_light\"}",
    "body_type": "Standard",
    "disc_break": false,
    "anti_theft_lock": true,
    "wind_shield": false,
    "led_light": true,
    "mileage": "2,300 km",
    "registration_city": "Un-Registered",
    "ad_saved": false,
    "is_user_ad": true,
    "pitch_upsell": true
  },
  "custom_dimensions": {
    "user_type": "Individual",
    "newsletter_subsriber": true,
    "car_listings": "1",
    "bike_listings": "0",
    "parts_listings": "0",
    "private_rides": "0",
    "public_rides": "2"
  }
}
